{
  "$schema": "https://json-schema.org/draft/2020-12/schema",
  "title": "AI-LTC State Schema v2",
  "description": "Single Source of Truth (SSOT) for AI-LTC runtime state. All agents must read this file before making decisions. No agent may override fields outside its permission scope.",
  "type": "object",
  "required": ["phase", "goal", "iteration", "max_iterations", "status", "authority"],
  "properties": {
    "phase": {
      "type": "string",
      "enum": ["INIT", "HANDOFF_READY", "EXECUTION", "REVIEW", "OPTIMIZER", "CHECKPOINT"],
      "description": "Current lifecycle phase. Transitions must follow kernel/state_machine.yaml rules."
    },
    "goal": {
      "type": "string",
      "minLength": 1,
      "description": "The current lane's primary objective. Must not change without optimizer or human approval."
    },
    "tasks": {
      "type": "array",
      "items": {
        "type": "object",
        "required": ["id", "desc", "status"],
        "properties": {
          "id": { "type": "integer", "description": "Unique task identifier. Monotonically increasing." },
          "desc": { "type": "string", "description": "Human-readable task description." },
          "status": { "type": "string", "enum": ["pending", "in_progress", "completed", "blocked", "skipped", "cancelled"], "description": "Current task status." },
          "priority": { "type": "string", "enum": ["high", "medium", "low"], "default": "medium", "description": "Task priority level." },
          "assignee": { "type": "string", "enum": ["execution", "review", "optimizer", "human", "ci"], "default": "execution", "description": "Responsible agent role." },
          "depends_on": { "type": "array", "items": { "type": "integer" }, "description": "Task IDs that must be completed before this task can start." },
          "tags": { "type": "array", "items": { "type": "string" }, "description": "Categorization tags (e.g., 'refactoring', 'CI', 'bugfix', 'feature')." },
          "estimated_effort": { "type": "string", "description": "Rough effort estimate (e.g., '1 day', '1 week', 'TBD')." },
          "qa": { "type": "string", "description": "Verification criteria: how to confirm this task is truly done. Must be specific and testable." },
          "started_at": { "type": "string", "format": "date-time", "description": "When the task was moved to in_progress." },
          "completed_at": { "type": "string", "format": "date-time", "description": "When the task was marked completed." },
          "evidence": { "type": "string", "description": "Proof of completion: commit hash, CI run ID, test output, etc." }
        }
      },
      "description": "Current task list. Execution agents may update status; only optimizer may add/remove tasks."
    },
    "blockers": {
      "type": "array",
      "items": {
        "type": "object",
        "required": ["id", "desc", "since_iteration"],
        "properties": {
          "id": { "type": "integer" },
          "desc": { "type": "string" },
          "since_iteration": { "type": "integer" },
          "retry_count": { "type": "integer", "default": 0 },
          "related_task": { "type": "integer", "description": "Task ID this blocker is blocking." },
          "resolution": { "type": "string", "description": "How the blocker was resolved (if resolved)." }
        }
      },
      "description": "Active blockers. A blocker repeating more than max_retries triggers escalation."
    },
    "next_action": {
      "type": "string",
      "description": "The single most important next step. Must be specific and executable."
    },
    "iteration": {
      "type": "integer",
      "minimum": 0,
      "description": "Current iteration count. Incremented each bounded pass."
    },
    "max_iterations": {
      "type": "integer",
      "minimum": 1,
      "default": 20,
      "description": "Maximum iterations before forced checkpoint. Configurable via ai-ltc-config.json."
    },
    "status": {
      "type": "string",
      "enum": ["idle", "running", "blocked", "reviewing", "optimizing", "done"],
      "description": "Runtime status of the current batch."
    },
    "authority": {
      "type": "string",
      "enum": ["system", "state", "model"],
      "default": "system",
      "description": "Current authority level. See kernel/control.yaml for priority chain."
    },
    "last_update": {
      "type": "string",
      "format": "date-time",
      "description": "ISO 8601 timestamp of the last state mutation."
    },
    "last_updated_by": {
      "type": "string",
      "description": "Agent or role that performed the last state update."
    },
    "context_summary": {
      "type": "string",
      "description": "Compressed context for cheap model input. Updated at each phase transition."
    },
    "error_state": {
      "type": ["object", "null"],
      "properties": {
        "type": { "type": "string" },
        "message": { "type": "string" },
        "recovery_action": { "type": "string" },
        "recovery_attempted": { "type": "integer", "default": 0 }
      },
      "description": "Active error state. See kernel/error_model.yaml for error types and recovery strategies."
    },
    "integrity": {
      "type": "object",
      "description": "State file integrity metadata. Updated on every write.",
      "properties": {
        "hash": { "type": "string", "description": "SHA-256 hash of the state file content (excluding this field)." },
        "previous_hash": { "type": "string", "description": "SHA-256 hash of the previous state version." },
        "version": { "type": "integer", "description": "Monotonically increasing version counter." },
        "signed_by": { "type": "string", "description": "Agent role that signed this version." }
      }
    },
    "audit_trail": {
      "type": "array",
      "items": {
        "type": "object",
        "properties": {
          "timestamp": { "type": "string", "format": "date-time" },
          "actor": { "type": "string" },
          "action": { "type": "string" },
          "field": { "type": "string" },
          "old_value": {},
          "new_value": {}
        }
      },
      "maxItems": 50,
      "description": "Recent state mutations for audit. Capped at 50 entries (oldest removed first)."
    }
  }
}
